{
  "schema_version":"1.0.0",
  "plan_id":"d67a05b2-4a4e-58d8-8a06-b34c1d4cae75",
  "created_at":"2026-08-26T03:30:00Z",
  "git_commit":"e75c2b6138cf1f65e863e49d64deb41bcf10222a",
  "classification":"S1_APPEND",
  "mode":"APPLY",
  "intent":"Create one dedicated recpro_identity MySQL login and grant only the exact table-level SELECT, INSERT, and UPDATE privileges required by the IAM adapter. Grant no schema, deletion, grant-option, graph, vector, model, or business-data capability.",
  "environment":{"environment_id":"recpro_local_research_g11_identity_principal","workspace":"/Users/tianyuhang/Documents/RecPro","host_fingerprint":"sha256:96ccbbc5748e804b0cd8df6adce38d458e93aaa83f2528f107bfa33727afaad1","database_identity":"mysql://127.0.0.1:62306/recpro","index_namespace":null},
  "targets":[
    {"kind":"MYSQL","identifier":"mysql-principal:recpro_identity@%","operation":"CREATE","expected_before_count":0,"expected_after_min_count":1},
    {"kind":"MYSQL","identifier":"recpro.iam_user_account:SELECT","operation":"APPEND","expected_before_count":0,"expected_after_min_count":1},
    {"kind":"MYSQL","identifier":"recpro.iam_user_account:INSERT","operation":"APPEND","expected_before_count":0,"expected_after_min_count":1},
    {"kind":"MYSQL","identifier":"recpro.iam_user_account:UPDATE","operation":"APPEND","expected_before_count":0,"expected_after_min_count":1},
    {"kind":"MYSQL","identifier":"recpro.iam_login_identifier:SELECT","operation":"APPEND","expected_before_count":0,"expected_after_min_count":1},
    {"kind":"MYSQL","identifier":"recpro.iam_login_identifier:INSERT","operation":"APPEND","expected_before_count":0,"expected_after_min_count":1},
    {"kind":"MYSQL","identifier":"recpro.iam_password_credential:SELECT","operation":"APPEND","expected_before_count":0,"expected_after_min_count":1},
    {"kind":"MYSQL","identifier":"recpro.iam_password_credential:INSERT","operation":"APPEND","expected_before_count":0,"expected_after_min_count":1},
    {"kind":"MYSQL","identifier":"recpro.iam_password_credential:UPDATE","operation":"APPEND","expected_before_count":0,"expected_after_min_count":1},
    {"kind":"MYSQL","identifier":"recpro.iam_role:SELECT","operation":"APPEND","expected_before_count":0,"expected_after_min_count":1},
    {"kind":"MYSQL","identifier":"recpro.iam_permission:SELECT","operation":"APPEND","expected_before_count":0,"expected_after_min_count":1},
    {"kind":"MYSQL","identifier":"recpro.iam_role_permission_fact:SELECT","operation":"APPEND","expected_before_count":0,"expected_after_min_count":1},
    {"kind":"MYSQL","identifier":"recpro.iam_user_role_fact:SELECT","operation":"APPEND","expected_before_count":0,"expected_after_min_count":1},
    {"kind":"MYSQL","identifier":"recpro.iam_user_role_fact:INSERT","operation":"APPEND","expected_before_count":0,"expected_after_min_count":1},
    {"kind":"MYSQL","identifier":"recpro.iam_auth_session:SELECT","operation":"APPEND","expected_before_count":0,"expected_after_min_count":1},
    {"kind":"MYSQL","identifier":"recpro.iam_auth_session:INSERT","operation":"APPEND","expected_before_count":0,"expected_after_min_count":1},
    {"kind":"MYSQL","identifier":"recpro.iam_auth_session:UPDATE","operation":"APPEND","expected_before_count":0,"expected_after_min_count":1},
    {"kind":"MYSQL","identifier":"recpro.iam_refresh_token:SELECT","operation":"APPEND","expected_before_count":0,"expected_after_min_count":1},
    {"kind":"MYSQL","identifier":"recpro.iam_refresh_token:INSERT","operation":"APPEND","expected_before_count":0,"expected_after_min_count":1},
    {"kind":"MYSQL","identifier":"recpro.iam_refresh_token:UPDATE","operation":"APPEND","expected_before_count":0,"expected_after_min_count":1},
    {"kind":"MYSQL","identifier":"recpro.iam_action_token:SELECT","operation":"APPEND","expected_before_count":0,"expected_after_min_count":1},
    {"kind":"MYSQL","identifier":"recpro.iam_action_token:INSERT","operation":"APPEND","expected_before_count":0,"expected_after_min_count":1},
    {"kind":"MYSQL","identifier":"recpro.iam_action_token:UPDATE","operation":"APPEND","expected_before_count":0,"expected_after_min_count":1},
    {"kind":"MYSQL","identifier":"recpro.iam_security_event:SELECT","operation":"APPEND","expected_before_count":0,"expected_after_min_count":1},
    {"kind":"MYSQL","identifier":"recpro.iam_security_event:INSERT","operation":"APPEND","expected_before_count":0,"expected_after_min_count":1},
    {"kind":"MYSQL","identifier":"recpro.user_personalization_consent_fact:SELECT","operation":"APPEND","expected_before_count":0,"expected_after_min_count":1},
    {"kind":"MYSQL","identifier":"recpro.user_personalization_consent_fact:INSERT","operation":"APPEND","expected_before_count":0,"expected_after_min_count":1},
    {"kind":"MYSQL","identifier":"recpro.iam_effective_role_permission_v:SELECT","operation":"APPEND","expected_before_count":0,"expected_after_min_count":1},
    {"kind":"MYSQL","identifier":"recpro.iam_effective_user_role_v:SELECT","operation":"APPEND","expected_before_count":0,"expected_after_min_count":1},
    {"kind":"MYSQL","identifier":"recpro.user_effective_personalization_consent_v:SELECT","operation":"APPEND","expected_before_count":0,"expected_after_min_count":1}
  ],
  "input_hashes":{"backend/app/composition.py":"3bdd5b202f098707fbd1a0ac87aa1e06e2874c75fee723307f36675e3526b92c","backend/app/config.py":"f27d2cf1855b7b6e2ed94d737f269114613d5c48a0f73850a8746808a95cdaa2","backend/app/identity/adapters/mysql.py":"633de80fdf4e04940faea85b5ac97340b0c56915394f81d0fccb45a1e907ecb7","scripts/build_g11_identity_principal_plan.py":"6b3fb942448c3da96f7a2ad4f17b6019b2084a802f957526831cfee8a9c170bf","scripts/execute_g11_identity_principal.py":"0bde6ceba78a223a0a2cb1d74c94ff9facfac4c48696a5819b86ea6261a31ea3"},
  "idempotency_key":"g11-identity-principal-e75c2b6138cf",
  "max_changes":30,
  "preconditions":["reviewed identity principal implementation commit is exactly e75c2b6138cf1f65e863e49d64deb41bcf10222a and remains an ancestor of execution","the G11 identity schema plan has already completed and all 15 IAM tables/views exist","the user separately approves this unchanged principal plan_id and canonical plan_hash before any database connection","recpro_identity@% does not exist; an exact complete grant set is accepted only as a zero-change idempotent replay","a root credential and a separately supplied 20+ character recpro_identity password exist only in the local protected environment file and are never printed","allowed privileges are table-level SELECT, INSERT, and UPDATE only; DELETE, DROP, ALTER, CREATE, REFERENCES, INDEX, FILE, PROCESS, SUPER, and GRANT OPTION are forbidden","business row writes, DeepSeek calls, Neo4j/Chroma writes, file deletions, container changes, and volume changes are exactly 0","partial principal or grant state fails closed and requires a new forward-only successor plan; no principal or grant is removed automatically"],
  "safety_assertions":{"file_deletions":0,"database_physical_deletions":0,"overwrite_existing":false,"destructive_capabilities_required":false,"counts_must_not_decrease":true},
  "plan_hash":"7a6ad99a35abf778595cd4f6c6868b7f7e8a1fa175b67d308845b74e32aa31c7"
}
